<?xml version="1.0" encoding="UTF-8"?>
<!--
    SYSTEM ID  : nbres:/uk/org/rlinsdale/nbpcg/nbpcgbuild.dtd

    Author     : Richard Linsdale (richard.linsdale at blueyonder.co.uk)
-->

<!ELEMENT nbpcg-build (folder+, execute+) >
    <!ATTLIST nbpcg-build
        name CDATA #REQUIRED
        >
    <!ELEMENT folder EMPTY >
        <!ATTLIST folder
            location (java|resource|project) #REQUIRED
            name CDATA #REQUIRED
            project CDATA #REQUIRED
            package CDATA #IMPLIED
            >
    <!ELEMENT execute EMPTY >
        <!ATTLIST execute
            action (message|entitytemplate) #REQUIRED
            message CDATA #IMPLIED
            template CDATA #IMPLIED
            type CDATA #IMPLIED
            folder CDATA #IMPLIED
            filename CDATA #IMPLIED
            usedbinfo CDATA #IMPLIED
            useentityinfo CDATA #IMPLIED
            usefield CDATA #IMPLIED
            log CDATA #IMPLIED
            package CDATA #IMPLIED
            datapackage CDATA #IMPLIED
            nodepackage CDATA #IMPLIED
            nodeeditorpackage CDATA #IMPLIED
            license CDATA #IMPLIED
            copyright CDATA #IMPLIED
            >