<?xml version="1.0" encoding="UTF-8"?>
    
    <!DOCTYPE nbpcg-build PUBLIC "-//uk/org/rlinsdale/nbpcgbuild/DTD NBPCGBUILD SCHEMA 1.0//EN" "nbres:/uk/org/rlinsdale/nbpcg/nbpcgbuild.dtd">
<nbpcg-build name="CD Archive" copyright="2014-2015 Richard Linsdale (richard.linsdale at blueyonder.co.uk)">
    <folder project="CD Archive - generated" location="resource" package="uk.org.rlinsdale.cdarchive.mysql" message="generating mysql script files for cdarchive" log="linsdale.cdarchive" license="gpl30">
        <execute template="createsqldatabase" filename="createdb.sql" usepersistencestore="cdarchive"/>
        <execute template="backupscript" filename="backupscript.sh" usepersistencestore="cdarchive"/>
        <execute template="createsqltables" filename="createtables.sql" usepersistencestore="cdarchive"/>
    </folder>
    <folder project="CD Archive - generated" location="java" package="uk.org.rlinsdale.cdarchive.dataobjects" message="generating entity files" log="linsdale.cdarchive" license="gpl30">
        <execute template="rootentity" filename="CdRoot.java" useentityinfo="CdRoot"/>
        <execute template="rootentity" filename="FileRoot.java" useentityinfo="FileRoot"/>
        <execute template="rootentity" filename="FolderRoot.java" useentityinfo="FolderRoot"/>
        <execute template="rootentity" filename="ExtensiongroupRoot.java" useentityinfo="ExtensiongroupRoot"/>
        <execute template="entity" filename="Cd.java" useentityinfo="Cd"/>
        <execute template="entity" filename="Folder.java" useentityinfo="Folder"/>
        <execute template="entity" filename="File.java" useentityinfo="File"/>
        <execute template="entity" filename="Extensiongroup.java" useentityinfo="Extensiongroup"/>
        <execute template="entity" filename="Extension.java" useentityinfo="Extension"/>
    </folder>
    <folder project="CD Archive - generated" location="java" package="uk.org.rlinsdale.cdarchive.nodes" message="generating node files" log="linsdale.cdarchive" license="gpl30" datapackage="uk.org.rlinsdale.cdarchive.dataobjects">
        <execute template="rootnode" type="" filename="CdRootNode.java" useentityinfo="CdRoot"/>
        <execute template="rootnode" type="" filename="FileRootNode.java" useentityinfo="FileRoot"/>
        <execute template="rootnode" type="" filename="FolderRootNode.java" useentityinfo="FolderRoot"/>
        <execute template="rootnode" type="" filename="ExtensiongroupRootNode.java" useentityinfo="ExtensiongroupRoot"/>
        <execute template="node" type="" filename="CdNode.java" useentityinfo="Cd"/>
        <execute template="node" type="" filename="FileNode.java" useentityinfo="File"/>
        <execute template="node" type="" filename="FolderNode.java" useentityinfo="Folder"/>
        <execute template="node" type="" filename="ExtensiongroupNode.java" useentityinfo="Extensiongroup"/>
        <execute template="node" type="" filename="ExtensionNode.java" useentityinfo="Extension"/>
        <execute template="nodefactory" type="" filename="CdRootNodeChildFactory.java" useentityinfo="CdRoot"/>
        <execute template="nodefactory" type="" filename="FileRootNodeChildFactory.java" useentityinfo="FileRoot"/>
        <execute template="nodefactory" type="" filename="FolderRootNodeChildFactory.java" useentityinfo="FolderRoot"/>
        <execute template="nodefactory" type="" filename="ExtensiongroupRootNodeChildFactory.java" useentityinfo="ExtensiongroupRoot"/>
        <execute template="nodefactory" type="" filename="ExtensiongroupNodeChildFactory.java" useentityinfo="Extensiongroup"/>
        <execute template="undonode" filename="UndoExtensiongroupNode.java" useentityinfo="Extensiongroup"/>
        <execute template="undonode" filename="UndoExtensionNode.java" useentityinfo="Extension"/>
        <execute template="addnode" filename="AddExtensiongroupNode.java" useentityinfo="Extensiongroup"/>
        <execute template="addnode" filename="AddExtensionNode.java" useentityinfo="Extension"/>
    </folder>
    <folder project="CD Archive - generated" location="java" package="uk.org.rlinsdale.cdarchive.topcomponents" message="generating node viewer files" log="linsdale.cdarchive" license="gpl30" datapackage="uk.org.rlinsdale.cdarchive.dataobjects" nodepackage="uk.org.rlinsdale.cdarchive.nodes">
        <execute template="rootnodeviewer" type="Tree" filename="CdRootNodeViewer.java" useentityinfo="CdRoot"/>
        <execute template="rootnodeviewer" type="Tree" filename="ExtensiongroupRootNodeViewer.java" useentityinfo="ExtensiongroupRoot"/>
    </folder>
</nbpcg-build>
    
    
    
    
        
    
        
    
    
    
        
            
                
                 
                
            
            
                
                
                
                
                
            
            
                
                
                
                
                 
                
                
            
            
                
                
            
            
                
            
        
    
