<?xml version="1.0" encoding="UTF-8"?>
    
    <!DOCTYPE nbpcg-build PUBLIC "-//uk/theretiredprogrammer/nbpcgbuild/DTD NBPCGBUILD SCHEMA 1.0//EN" "nbres:/uk/theretiredprogrammer/nbpcg/nbpcgbuild.dtd">
<nbpcg-build name="Photogallery" copyright="2015 Richard Linsdale (richard at theretiredprogrammer.uk)">
    <folder project="Photo Gallery - generated" location="resource" package="uk.theretiredprogrammer.photogallery.mysql" message="generating mysql script files for photogallery2" log="linsdale.photogallery" license="gpl30">
        <execute template="createsqldatabase" filename="createdb.sql" usepersistencestore="photogallery"/>
        <execute template="createsqldatabase" filename="createdb.sql" usepersistencestore="authentication"/>
        <execute template="backupscript" filename="backupscript.sh" usepersistencestore="photogallery"/>
        <execute template="backupscript" filename="backupscript.sh" usepersistencestore="authentication"/>
        <execute template="createsqltables" filename="createtables.sql" usepersistencestore="photogallery"/>
        <execute template="createsqltables" filename="createtables.sql" usepersistencestore="authentication"/>
    </folder>
    <folder project="Photo Gallery - generated" location="resource" package="uk.theretiredprogrammer.photogallery.mysql" message="generating mysql script files for authentication2" log="linsdale.photogallery" license="gpl30">
        <execute template="createsqldatabase" filename="createdb.sql" usepersistencestore="photogallery"/>
        <execute template="createsqldatabase" filename="createdb.sql" usepersistencestore="authentication"/>
        <execute template="backupscript" filename="backupscript.sh" usepersistencestore="photogallery"/>
        <execute template="backupscript" filename="backupscript.sh" usepersistencestore="authentication"/>
        <execute template="createsqltables" filename="createtables.sql" usepersistencestore="photogallery"/>
        <execute template="createsqltables" filename="createtables.sql" usepersistencestore="authentication"/>
    </folder>
    <folder project="Photo Gallery - generated" location="java" package="uk.theretiredprogrammer.photogallery.dataobjects" message="generating entity files" log="linsdale.photogallery" license="gpl30">
        <execute template="rootentity" filename="AlbumRoot.java" useentityinfo="AlbumRoot"/>
        <execute template="entity" filename="Album.java" useentityinfo="Album"/>
        <execute template="entity" filename="Albumpermission.java" useentityinfo="Albumpermission"/>
        <execute template="entity" filename="Group.java" useentityinfo="Group"/>
        <execute template="entity" filename="Albumgrouppermission.java" useentityinfo="Albumgrouppermission"/>
        <execute template="entity" filename="Image.java" useentityinfo="Image"/>
        <execute template="entity" filename="User.java" useentityinfo="User"/>
    </folder>
    <folder project="Photo Gallery - generated" location="java" package="uk.theretiredprogrammer.photogallery.nodes" message="generating node files" log="linsdale.photogallery" license="gpl30" datapackage="uk.theretiredprogrammer.photogallery.dataobjects">
        <execute template="rootnode" type="" filename="AlbumRootNode.java" useentityinfo="AlbumRoot"/>
        <execute template="rootnode" type="Icon" filename="AlbumRootIconNode.java" useentityinfo="AlbumRoot"/>
        <execute template="node" type="" filename="AlbumNode.java" useentityinfo="Album"/>
        <execute template="node" type="Icon" filename="AlbumIconNode.java" useentityinfo="Album"/>
        <execute template="node" type="" filename="ImageNode.java" useentityinfo="Image"/>
        <execute template="node" type="Icon" filename="ImageIconNode.java" useentityinfo="Image"/>
        <execute template="node" type="" filename="AlbumpermissionNode.java" useentityinfo="Albumpermission"/>
        <execute template="node" type="" filename="UserNode.java" useentityinfo="User"/>
        <execute template="node" type="" filename="AlbumgrouppermissionNode.java" useentityinfo="Albumgrouppermission"/>
        <execute template="node" type="" filename="GroupNode.java" useentityinfo="Group"/>
        <execute template="nodefactory" type="" filename="AlbumRootNodeChildFactory.java" useentityinfo="AlbumRoot"/>
        <execute template="nodefactory" type="" filename="AlbumNodeChildFactory.java" useentityinfo="Album"/>
        <execute template="nodefactory" type="Icon" filename="AlbumRootIconNodeChildFactory.java" useentityinfo="AlbumRoot"/>
        <execute template="nodefactory" type="Icon" filename="AlbumIconNodeChildFactory.java" useentityinfo="Album"/>
        <execute template="nodefactory" type="" filename="AlbumpermissionNodeChildFactory.java" useentityinfo="Albumpermission"/>
        <execute template="nodefactory" type="" filename="AlbumgrouppermissionNodeChildFactory.java" useentityinfo="Albumgrouppermission"/>
        <execute template="undonode" filename="UndoAlbumNode.java" useentityinfo="Album"/>
        <execute template="undonode" filename="UndoImageNode.java" useentityinfo="Image"/>
        <execute template="undonode" filename="UndoAlbumpermissionNode.java" useentityinfo="Albumpermission"/>
        <execute template="undonode" filename="UndoUserNode.java" useentityinfo="User"/>
        <execute template="undonode" filename="UndoAlbumgrouppermissionNode.java" useentityinfo="Albumgrouppermission"/>
        <execute template="undonode" filename="UndoGroupNode.java" useentityinfo="Group"/>
        <execute template="addnode" filename="AddAlbumNode.java" useentityinfo="Album"/>
        <execute template="addnode" filename="AddImageNode.java" useentityinfo="Image"/>
        <execute template="addnode" filename="AddAlbumpermissionNode.java" useentityinfo="Albumpermission"/>
        <execute template="addnode" filename="AddUserNode.java" useentityinfo="User"/>
        <execute template="addnode" filename="AddAlbumgrouppermissionNode.java" useentityinfo="Albumgrouppermission"/>
        <execute template="addnode" filename="AddGroupNode.java" useentityinfo="Group"/>
    </folder>
    <folder project="Photo Gallery - generated" location="java" package="uk.theretiredprogrammer.photogallery.topcomponents" message="generating node viewer files" log="linsdale.photogallery" license="gpl30" datapackage="uk.theretiredprogrammer.photogallery.dataobjects" nodepackage="uk.theretiredprogrammer.photogallery.nodes">
        <execute template="rootnodeviewer" type="Tree" filename="AlbumRootNodeViewer.java" useentityinfo="AlbumRoot"/>
        <execute template="rootnodeviewer" type="Icon" filename="AlbumRootIconNodeViewer.java" useentityinfo="AlbumRoot"/>
        <execute template="iconnodeviewer" filename="ImageIconNodeViewer.java" useentityinfo="Image"/>
    </folder>
    <folder project="Photo Gallery - generated" location="java" package="uk.theretiredprogrammer.photogallery.topcomponents" message="generating node editor files" log="linsdale.photogallery" license="gpl30" datapackage="uk.theretiredprogrammer.photogallery.dataobjects" nodepackage="uk.theretiredprogrammer.photogallery.nodes">
        <execute template="nodeeditor" filename="AlbumNodeEditor.java" useentityinfo="Album"/>
        <execute template="nodeeditor" filename="AlbumpermissionNodeEditor.java" useentityinfo="Albumpermission"/>
        <execute template="nodeeditor" filename="GroupNodeEditor.java" useentityinfo="Group"/>
        <execute template="nodeeditor" filename="AlbumgrouppermissionNodeEditor.java" useentityinfo="Albumgrouppermission"/>
        <execute template="nodeeditor" filename="ImageNodeEditor.java" useentityinfo="Image"/>
        <execute template="nodeeditor" filename="UserNodeEditor.java" useentityinfo="User"/>
        <execute template="editnode" filename="EditAlbumNode.java" useentityinfo="Album"/>
        <execute template="editnode" filename="EditImageNode.java" useentityinfo="Image"/>
        <execute template="editnode" filename="EditAlbumpermissionNode.java" useentityinfo="Albumpermission"/>
        <execute template="editnode" filename="EditUserNode.java" useentityinfo="User"/>
        <execute template="editnode" filename="EditAlbumgrouppermissionNode.java" useentityinfo="Albumgrouppermission"/>
        <execute template="editnode" filename="EditGroupNode.java" useentityinfo="Group"/>
        <execute template="choice" filename="ImageChoiceField.java" useentityinfo="Image"/>
        <execute template="enumchoice" filename="AlbumpermissionPermissionChoiceField.java" useentityinfo="Albumpermission" usefield="permission"/>
        <execute template="enumchoice" filename="AlbumgrouppermissionPermissionChoiceField.java" useentityinfo="Albumgrouppermission" usefield="permission"/>
    </folder>
</nbpcg-build>
    
    
        
        
            
        
        
            
        
    
    
    
        
            
                
                
                
                
            
            
                
            
            
                
            
            
                
            
            
                
                
                
                
            
        
        
            
                
                
                
                
            
        
    
